{
  "schema_version": "1.0",
  "spec_version": "1.0.0",
  "operation_id": "operation-01",
  "request_id": "request-submit-01",
  "target": {
    "mode": "session",
    "engine_id": "editor-engine",
    "instance_id": "instance-01",
    "object_id": "document-01",
    "locator": "session://instance-01/document-01"
  },
  "status": "running",
  "stage": "native_regeneration",
  "observed_at": "2026-10-03T00:00:10Z",
  "started_at": "2026-10-03T00:00:00Z",
  "wait_timeout_ms": 10000,
  "execution_deadline": null,
  "record": {
    "availability": "available",
    "retain_until": "2026-10-10T00:00:00Z",
    "survives_cli_exit": true,
    "survives_reconnect": true,
    "survives_instance_restart": false,
    "limitations": [
      "Synthetic example; no application was run.",
      "No native execution deadline is provided.",
      "Application restart can make the native task outcome unknown."
    ]
  },
  "commands": {
    "lookup": {
      "argv": [
        "operation",
        "status",
        "--id",
        "operation-01"
      ],
      "read_only": true
    },
    "result": {
      "argv": [
        "operation",
        "result",
        "--id",
        "operation-01"
      ],
      "read_only": true
    },
    "cancel": {
      "argv": [
        "operation",
        "cancel",
        "--id",
        "operation-01"
      ],
      "read_only": false
    }
  },
  "blocked": null,
  "stop_observed": false,
  "stop_evidence_ref": null,
  "receipt": null
}
